{
  "output_id": "bell-state-output-pass-001",
  "source": {
    "system_type": "simulator",
    "provider": "reference-example",
    "backend": "bell-state-simulator",
    "circuit_id": "bell-state-correlation"
  },
  "shots": 1000,
  "distribution": {
    "00": 0.48,
    "01": 0.02,
    "10": 0.01,
    "11": 0.49
  },
  "metadata": {
    "description": "Bell state correlation output expected to PASS deterministic evaluation."
  }
}
